{
  "schemaVersion": "MCQ_CORPUS/1",
  "corpusId": "SNC-QCM-PILOT",
  "corpusVersion": 4,
  "blueprintVersionId": "PEBC-PART-I-2026",
  "items": [
    {
      "itemId": "SNC-001",
      "version": 1,
      "status": "IN_REVIEW",
      "stem": "Quelles structures composent le système nerveux central?",
      "choices": [
        {
          "id": "A",
          "text": "Le cerveau et la moelle épinière"
        },
        {
          "id": "B",
          "text": "Le cerveau et les nerfs périphériques"
        },
        {
          "id": "C",
          "text": "La moelle épinière et les ganglions périphériques"
        },
        {
          "id": "D",
          "text": "Les nerfs crâniens et les nerfs spinaux"
        }
      ],
      "correctChoiceId": "A",
      "explanation": "la source définit le SNC comme le cerveau et la moelle épinière.",
      "difficulty": "FOUNDATION",
      "source": {
        "sourceVersionId": "8fdf1a28-6025-4846-a74b-1b4faca1d98f",
        "reference": {
          "type": "PAGE",
          "locator": "`SYSTÈME NERVEUX CENTRAL.pdf`, p. 1, section « C'est quoi le système nerveux central (SNC)? ».",
          "label": "`SYSTÈME NERVEUX CENTRAL.pdf`, p. 1, section « C'est quoi le système nerveux central (SNC)? »."
        }
      },
      "mappings": [
        {
          "domainId": "PEBC-2026-KNOWLEDGE-EXPERTISE",
          "competencyId": "PEBC-NAPRA-2026-2.2",
          "topicId": "SNC-ANATOMIE-FONCTIONNELLE",
          "objectiveIds": [
            "SNC-001-OA-01"
          ]
        }
      ]
    },
    {
      "itemId": "SNC-002",
      "version": 1,
      "status": "IN_REVIEW",
      "stem": "Une intervention pharmacologique vise à réduire une excitabilité neuronale excessive. Quel effet est le plus directement cohérent avec le rôle du GABA décrit dans la source?",
      "choices": [
        {
          "id": "A",
          "text": "Accroître la transmission excitatrice du glutamate"
        },
        {
          "id": "B",
          "text": "Stimuler la conversion périphérique de la lévodopa"
        },
        {
          "id": "C",
          "text": "Renforcer l'inhibition neuronale"
        },
        {
          "id": "D",
          "text": "Augmenter les décharges neuronales répétitives"
        }
      ],
      "correctChoiceId": "C",
      "explanation": "le GABA est présenté comme inhibiteur; l'augmenter renforce le « frein » neuronal et diminue l'excitabilité excessive.",
      "difficulty": "INTERMEDIATE",
      "source": {
        "sourceVersionId": "8fdf1a28-6025-4846-a74b-1b4faca1d98f",
        "reference": {
          "type": "PAGE",
          "locator": "p. 4 (« Balance excitation/inhibition ») et p. 40 (questions 147-150).",
          "label": "p. 4 (« Balance excitation/inhibition ») et p. 40 (questions 147-150)."
        }
      },
      "mappings": [
        {
          "domainId": "PEBC-2026-KNOWLEDGE-EXPERTISE",
          "competencyId": "PEBC-NAPRA-2026-2.2",
          "topicId": "SNC-NEUROTRANSMISSION-EPILEPSIE",
          "objectiveIds": [
            "SNC-002-OA-01"
          ]
        }
      ]
    },
    {
      "itemId": "SNC-003",
      "version": 1,
      "status": "IN_REVIEW",
      "stem": "Quatre molécules expérimentales diffèrent par leurs propriétés physicochimiques. Laquelle devrait traverser le plus facilement la barrière hémato-encéphalique selon la source?",
      "choices": [
        {
          "id": "A",
          "text": "Une grande molécule hydrophile et ionisée"
        },
        {
          "id": "B",
          "text": "Une petite molécule lipophile et non ionisée"
        },
        {
          "id": "C",
          "text": "Une grande molécule lipophile et ionisée"
        },
        {
          "id": "D",
          "text": "Une petite molécule hydrophile et ionisée"
        }
      ],
      "correctChoiceId": "B",
      "explanation": "la source associe le passage plus facile à une petite taille, à la lipophilie et à une forme non ionisée.",
      "difficulty": "INTERMEDIATE",
      "source": {
        "sourceVersionId": "8fdf1a28-6025-4846-a74b-1b4faca1d98f",
        "reference": {
          "type": "PAGE",
          "locator": "p. 4 (« Barrière hémato-encéphalique ») et p. 48-49 (questions 197-198).",
          "label": "p. 4 (« Barrière hémato-encéphalique ») et p. 48-49 (questions 197-198)."
        }
      },
      "mappings": [
        {
          "domainId": "PEBC-2026-KNOWLEDGE-EXPERTISE",
          "competencyId": "PEBC-NAPRA-2026-2.2",
          "topicId": "SNC-PHARMACOCINETIQUE-BHE",
          "objectiveIds": [
            "SNC-003-OA-01"
          ]
        }
      ]
    },
    {
      "itemId": "SNC-004",
      "version": 1,
      "status": "IN_REVIEW",
      "stem": "Une personne qui utilise un opioïde présente une somnolence profonde et une respiration nettement ralentie. Quelle est la meilleure priorité immédiate selon la source?",
      "choices": [
        {
          "id": "A",
          "text": "Attendre la présence simultanée de pupilles très serrées pour confirmer le tableau complet"
        },
        {
          "id": "B",
          "text": "Omettre la prochaine dose et demander une réévaluation non urgente pendant les heures ouvrables"
        },
        {
          "id": "C",
          "text": "Réveiller la personne, puis observer si la respiration s'améliore durablement avant de décider"
        },
        {
          "id": "D",
          "text": "Appeler immédiatement le 911, administrer la naloxone si elle est disponible, rester auprès de la personne et suivre les consignes d'urgence"
        }
      ],
      "correctChoiceId": "D",
      "explanation": "Santé Canada recommande d'appeler immédiatement le 911 en cas de surdose soupçonnée, d'administrer la naloxone si elle est disponible, de rester auprès de la personne et de suivre les consignes d'urgence. La naloxone ne remplace jamais l'appel au 911.",
      "difficulty": "ADVANCED",
      "source": {
        "sourceVersionId": "8fdf1a28-6025-4846-a74b-1b4faca1d98f",
        "reference": {
          "type": "PAGE",
          "locator": "p. 12 (dépression respiratoire) et p. 18 (signes classiques et « si respiration ralentie : urgence »).",
          "label": "p. 12 (dépression respiratoire) et p. 18 (signes classiques et « si respiration ralentie : urgence »)."
        }
      },
      "mappings": [
        {
          "domainId": "PEBC-2026-CLINICAL-CARE",
          "competencyId": "PEBC-NAPRA-2026-1.4",
          "topicId": "SNC-OPIOIDES-SECURITE",
          "objectiveIds": [
            "SNC-004-OA-01"
          ]
        }
      ]
    },
    {
      "itemId": "SNC-005",
      "version": 1,
      "status": "IN_REVIEW",
      "stem": "Une personne traitée par un antipsychotique de première génération développe rigidité et tremblements. Quelle action réceptorielle explique le plus directement ces manifestations selon la source?",
      "choices": [
        {
          "id": "A",
          "text": "Blocage des récepteurs histaminiques H1 produisant principalement une sédation"
        },
        {
          "id": "B",
          "text": "Blocage excessif des récepteurs dopaminergiques D2 dans les voies motrices"
        },
        {
          "id": "C",
          "text": "Blocage des récepteurs sérotoninergiques 5-HT2A caractéristique des effets moteurs décrits"
        },
        {
          "id": "D",
          "text": "Blocage des récepteurs muscariniques expliquant à lui seul la rigidité et les tremblements"
        }
      ],
      "correctChoiceId": "B",
      "explanation": "la source relie directement le blocage D2 dans les voies motrices à la rigidité, aux tremblements, à l'akathisie et à la dystonie.",
      "difficulty": "INTERMEDIATE",
      "source": {
        "sourceVersionId": "8fdf1a28-6025-4846-a74b-1b4faca1d98f",
        "reference": {
          "type": "PAGE",
          "locator": "p. 18-19, questions 42-48.",
          "label": "p. 18-19, questions 42-48."
        }
      },
      "mappings": [
        {
          "domainId": "PEBC-2026-CLINICAL-CARE",
          "competencyId": "PEBC-NAPRA-2026-1.2",
          "topicId": "SNC-ANTIPSYCHOTIQUES",
          "objectiveIds": [
            "SNC-005-OA-01"
          ]
        }
      ]
    },
    {
      "itemId": "SNC-006",
      "version": 1,
      "status": "IN_REVIEW",
      "stem": "Une personne qui prend de la sertraline depuis trois jours ne constate pas encore d'amélioration et conclut que le médicament ne fonctionne pas. Quelle explication est la plus conforme à la source?",
      "choices": [
        {
          "id": "A",
          "text": "La sertraline n'agit sur la sérotonine qu'après plusieurs semaines parce que son absorption est très lente"
        },
        {
          "id": "B",
          "text": "L'absence d'effet après trois jours confirme un échec et justifie un arrêt brusque"
        },
        {
          "id": "C",
          "text": "La sertraline inhibe la recapture de la sérotonine, mais l'amélioration clinique peut demander plusieurs semaines; le mécanisme expliquant ce délai clinique est complexe"
        },
        {
          "id": "D",
          "text": "Le traitement doit être pris uniquement les jours où les symptômes sont plus marqués pour accélérer la réponse"
        }
      ],
      "correctChoiceId": "C",
      "explanation": "l'inhibition de la recapture de la sérotonine est un mécanisme établi de la sertraline, tandis que l'amélioration clinique peut nécessiter plusieurs semaines. Le délai thérapeutique ne doit pas être attribué avec certitude à un mécanisme unique d'adaptation des récepteurs ou des circuits.",
      "difficulty": "INTERMEDIATE",
      "source": {
        "sourceVersionId": "8fdf1a28-6025-4846-a74b-1b4faca1d98f",
        "reference": {
          "type": "PAGE",
          "locator": "p. 23-24, questions 63-67 et 69.",
          "label": "p. 23-24, questions 63-67 et 69."
        }
      },
      "mappings": [
        {